{
  "$schema": "https://json-schema.org/draft/2020-12/schema",
  "$id": "https://pathweaver.dev/schema/v1.json",
  "type": "object",
  "properties": {
    "settings": {
      "type": "object",
      "properties": {
        "version": { "const": "1.0" },
        "startDate": { "type": "string", "pattern": "^\\d{4}-\\d{2}-\\d{2}$" },
        "workweek": {
          "type": "array",
          "items": { "type": "integer", "minimum": 1, "maximum": 7 },
          "uniqueItems": true
        }
      },
      "required": ["version"],
      "additionalProperties": true
    },
    "nodes": {
      "type": "array",
      "items": {
        "type": "object",
        "properties": {
          "id": { "type": "string", "minLength": 1 },
          "type": { "enum": ["start", "task", "end"] },
          "title": { "type": "string" },
          "duration": { "type": "number", "minimum": 0 },
          "x": { "type": "number" },
          "y": { "type": "number" }
        },
        "required": ["id", "type"],
        "additionalProperties": true
      }
    },
    "edges": {
      "type": "array",
      "items": {
        "type": "object",
        "properties": {
          "from": { "type": "string", "minLength": 1 },
          "to": { "type": "string", "minLength": 1 }
        },
        "required": ["from", "to"],
        "additionalProperties": false
      }
    },
    "computed": {
      "type": "object",
      "description": "Optional computed CPM results — present in app exports. Not required for import validation.",
      "additionalProperties": true
    }
  },
  "required": ["nodes", "edges"],
  "additionalProperties": false
}
